{
  "eventId": "aaaaaaaa-aaaa-4aaa-8aaa-aaaaaaaaaaa1",
  "eventType": "InventoryReservationRequested",
  "eventVersion": 1,
  "occurredAt": "2026-09-13T20:00:00Z",
  "correlationId": "11111111-1111-4111-8111-111111111111",
  "causationId": "cccccccc-cccc-4ccc-8ccc-ccccccccccc1",
  "aggregateId": "11111111-1111-4111-8111-111111111111",
  "producer": "order-service",
  "payload": {
    "orderId": "11111111-1111-4111-8111-111111111111",
    "items": [
      { "productId": "22222222-2222-4222-8222-222222222221", "quantity": 2 },
      { "productId": "22222222-2222-4222-8222-222222222222", "quantity": 1 }
    ]
  }
}
