{
  "eventId": "aaaaaaaa-aaaa-4aaa-8aaa-aaaaaaaaaaa9",
  "eventType": "PaymentDeclined",
  "eventVersion": 1,
  "occurredAt": "2026-09-13T20:00:04Z",
  "correlationId": "11111111-1111-4111-8111-111111111111",
  "causationId": "aaaaaaaa-aaaa-4aaa-8aaa-aaaaaaaaaaa7",
  "aggregateId": "44444444-4444-4444-8444-444444444444",
  "producer": "payment-worker",
  "payload": {
    "orderId": "11111111-1111-4111-8111-111111111111",
    "paymentId": "44444444-4444-4444-8444-444444444444",
    "externalPaymentId": "ext_pay_001",
    "amount": "259.90",
    "currency": "BRL",
    "reasonCode": "INSUFFICIENT_FUNDS",
    "declinedAt": "2026-09-13T20:00:04Z"
  }
}
