{
  "eventId": "aaaaaaaa-aaaa-4aaa-8aaa-aaaaaaaaaaa6",
  "eventType": "PaymentRequested",
  "eventVersion": 1,
  "occurredAt": "2026-09-13T20:00:02Z",
  "correlationId": "11111111-1111-4111-8111-111111111111",
  "causationId": "aaaaaaaa-aaaa-4aaa-8aaa-aaaaaaaaaaa2",
  "aggregateId": "11111111-1111-4111-8111-111111111111",
  "producer": "order-service",
  "payload": {
    "orderId": "11111111-1111-4111-8111-111111111111",
    "reservationId": "33333333-3333-4333-8333-333333333333",
    "amount": "259.90",
    "currency": "BRL",
    "paymentMethodToken": "tok_pending"
  }
}
